{
  "schema_version": "ppg-stage-quality-contract/v0.1",
  "stage_id": "S09B",
  "active_profile_source": "S09A selected control bundle plus active target-unit packet policy; no global venue/profile default",
  "must_read_materials": [
    {
      "material_ref": "S09A_selected_control_bundle",
      "read_mode": "full",
      "required_extractions": [
        "selected_controls",
        "control_priority_map",
        "context_usage_instructions",
        "deferred_controls"
      ]
    },
    {
      "material_ref": "target_unit_profile",
      "read_mode": "full",
      "required_extractions": [
        "unit_id",
        "allowed_write_path",
        "target_stage"
      ]
    },
    {
      "material_ref": "material_closure_sources",
      "read_mode": "targeted",
      "required_extractions": [
        "unit_material_closure",
        "material_access_manifest",
        "material_read_obligations"
      ]
    },
    {
      "material_ref": "validator_and_return_contracts",
      "read_mode": "targeted",
      "required_extractions": [
        "validator_refs",
        "CandidateArtifactReturn",
        "single_writer_lock"
      ]
    }
  ],
  "required_extractions": [
    "packet_identity",
    "allowed_read_paths",
    "allowed_write_paths",
    "forbidden_routes",
    "worker_boot_clause",
    "selected_controls_lossless_projection",
    "unit_material_closure",
    "material_access_manifest",
    "material_read_obligations",
    "deferred_control_ledger",
    "return_format",
    "single_writer_lock",
    "missing_material_report",
    "emitted_packet_validation"
  ],
  "producer_return_obligations": [
    "validate_packet-clean TaskPacket with packet identity and target unit",
    "lossless selected_controls projection from S09A including usage labels and negative controls",
    "unit_material_closure and material_access_manifest",
    "material_read_obligations that later S10/S11 must acknowledge with read receipts",
    "allowed paths, forbidden routes, worker boot clause, and no-completion boundary",
    "single_writer_lock, stale policy, return_format, and emitted_packet_validation evidence",
    "missing_material_report that blocks candidate production when closure is incomplete"
  ],
  "audit_verifier_obligations": {
    "inherits_all_producer_inputs": true,
    "checks": [
      "packet is not a generic prompt and preserves S09A selected_controls losslessly",
      "unit_material_closure, material_access_manifest, and material_read_obligations are exact and closed",
      "allowed paths and write lock are scoped to the target unit",
      "worker boot clause forbids completion claims, recursion, and owner-intent changes",
      "emitted packet validates before dispatch",
      "missing material blocks S10/S11 instead of being hidden as optional context"
    ]
  },
  "downstream_design_force": [
    "S10/S11 producers must receive all controls, material_read_obligations, and return obligations in the packet",
    "S10/S11 verifiers must compare read receipts and candidate outputs against S09B material closure",
    "S12/S13/S16 and RenderedManuscriptAuditGate can audit whether generated units obey the exact packet obligations"
  ],
  "failure_severity_policy": {
    "BLOCKING": "packet omits material closure, read obligations, authority boundary, or validation evidence",
    "MAJOR": "packet compresses selected controls into generic guidance or loses S09A usage labels",
    "MINOR": "local path label, return-format, or lock metadata defect without authority expansion",
    "WATCH": "non-blocking downstream usability concern tracked for verifier attention"
  },
  "nearest_responsible_stage_policy": "S09B owns packet compilation defects; missing selected controls route to S09A, missing source/design material routes to its concrete upstream stage.",
  "affected_downstream_nodes": [
    "S10",
    "S11",
    "S12",
    "S13",
    "S15",
    "S16",
    "RenderedManuscriptAuditGate"
  ],
  "anti_over_strictness_boundary": "MINOR/WATCH metadata defects can be repaired in the packet locally; do not force S04-S08 reruns unless selected controls or material closure are substantively wrong."
}
