{
  "schema_version": "ppg-stage-quality-contract/v0.1",
  "stage_id": "S09A",
  "active_profile_source": "active paper profile plus S04-S08 unit-specific controls; no global venue/profile default",
  "must_read_materials": [
    {
      "material_ref": "target_unit_profile",
      "read_mode": "full",
      "required_extractions": [
        "unit_id",
        "unit_type",
        "target_stage",
        "allowed_outputs"
      ]
    },
    {
      "material_ref": "S04_claim_admissibility",
      "read_mode": "targeted",
      "required_extractions": [
        "allowed_claims",
        "forbidden_wording",
        "evidence_anchors"
      ]
    },
    {
      "material_ref": "S05_reader_spine",
      "read_mode": "targeted",
      "required_extractions": [
        "reader_question",
        "section_function",
        "front_half_payoff"
      ]
    },
    {
      "material_ref": "S06_object_granularity",
      "read_mode": "targeted",
      "required_extractions": [
        "object_cards",
        "variable_cards",
        "explanation_ladder"
      ]
    },
    {
      "material_ref": "S07_surface_control",
      "read_mode": "targeted",
      "required_extractions": [
        "terminology_rules",
        "rhetorical_moves",
        "forbidden_expressions"
      ]
    },
    {
      "material_ref": "S08_visual_formal_plan",
      "read_mode": "targeted",
      "required_extractions": [
        "visual_callouts",
        "caption_boundaries",
        "artifact_contracts"
      ]
    }
  ],
  "required_extractions": [
    "hard_constraints",
    "local_adjacent_global_context_layers",
    "positive_negative_controls",
    "control_priority_map",
    "conflict_resolution_log",
    "context_usage_instructions",
    "freshness_check",
    "coverage_ledger",
    "downstream_packet_requirements"
  ],
  "producer_return_obligations": [
    "selected_control_bundle with S04-S08 source refs",
    "control_priority_map and conflict_resolution_log",
    "context_usage_instructions with allowed/forbidden use labels",
    "freshness and missing_control_report",
    "coverage_ledger mapping every required upstream control to selected/deferred/rejected",
    "downstream_packet_requirements for S09B packet identity, paths, validators, return format, and lock policy"
  ],
  "audit_verifier_obligations": {
    "inherits_all_producer_inputs": true,
    "checks": [
      "all S04-S08 controls required by the target unit are selected, deferred with reason, or routed upstream",
      "control_priority_map resolves conflicts before packet assembly",
      "context layers are labeled as claim authority, background, adjacent context, or forbidden use",
      "downstream_packet_requirements are sufficiently concrete for S09B without worker guessing",
      "S09A does not emit final content or worker task packet",
      "nearest responsible stage routing is explicit for missing controls"
    ]
  },
  "downstream_design_force": [
    "S09B must preserve selected controls and usage labels losslessly",
    "S10/S11 receive concrete move, claim, object, surface, and visual obligations instead of a generic writing prompt",
    "S12/S13/S16 and RenderedManuscriptAuditGate can trace each produced unit back to selected controls"
  ],
  "failure_severity_policy": {
    "BLOCKING": "target unit lacks mandatory hard constraints, claim controls, or downstream packet requirements",
    "MAJOR": "selected controls are incomplete, stale, or conflict without resolution",
    "MINOR": "local labeling or priority-map defect that can be repaired without changing upstream semantics",
    "WATCH": "potential downstream usability risk tracked without forced full rerun"
  },
  "nearest_responsible_stage_policy": "S09A owns control selection defects; missing upstream substance routes to the concrete source stage S04/S05/S06/S07/S08, never bare S09.",
  "affected_downstream_nodes": [
    "S09B",
    "S10",
    "S11",
    "S12",
    "S13",
    "S16",
    "RenderedManuscriptAuditGate"
  ],
  "anti_over_strictness_boundary": "MINOR and WATCH findings may update local labels, priority order, or risk ledger; only BLOCKING/MAJOR unresolved control failures force upstream backflow."
}
